Neighborhood,Price,Bedrooms,Bathrooms,House Size,Description,Neighborhood Description
Maple Ridge,"$950,000",4,3.5,"3,200 sqft","Experience luxury living in this stunning 4-bedroom, 3.5-bathroom home located in the serene Maple Ridge neighborhood. This modern masterpiece features an open floor plan, gourmet kitchen with high-end appliances, and a magnificent living room with a stone fireplace. The master suite offers a spa-like bathroom and a large walk-in closet. Enjoy outdoor living with a beautifully landscaped backyard, complete with a patio and fire pit.","Maple Ridge is a prestigious neighborhood known for its spacious parks, top-rated schools, and exclusive golf club. Residents enjoy quiet, tree-lined streets and a friendly community atmosphere. With fine dining options and upscale shopping, Maple Ridge offers a perfect blend of suburban tranquility and luxury amenities."
Bluewater Bay,"$650,000",3,2.0,"2,500 sqft","Discover coastal living in Bluewater Bay, where this elegant 3-bedroom, 2-bathroom home awaits. Situated near the water, this property features breathtaking views, a bright and airy floor plan, and a gourmet kitchen that opens to a spacious living area. The master suite boasts private access to the deck, where you can enjoy the peaceful water views. This home is a tranquil retreat for those who love the water.","Bluewater Bay is a vibrant, waterfront community offering residents a lifestyle filled with outdoor adventures, from boating and fishing to beach days and waterfront dining. The neighborhood is known for its safe, friendly atmosphere and community events. With its picturesque surroundings, Bluewater Bay is the ideal place for those seeking a relaxed coastal lifestyle."
Sunnyvale,"$1,200,000",5,4.5,"4,000 sqft","Welcome to this breathtaking 5-bedroom, 4.5-bathroom estate in the heart of Sunnyvale. Featuring a stunning entryway, an expansive living area with floor-to-ceiling windows, and a chef's kitchen with marble countertops, this home redefines luxury. The backyard oasis includes a pool, hot tub, and outdoor kitchen, making it perfect for entertaining. The spacious bedrooms and elegant bathrooms provide a peaceful retreat for family and guests alike.","Sunnyvale offers a unique mix of suburban comfort and urban convenience, making it one of the most sought-after neighborhoods. Known for its excellent schools, beautiful parks, and diverse community, Sunnyvale also boasts a dynamic tech scene. Residents can enjoy a wide range of dining and shopping options, as well as easy access to public transportation and major highways, providing an ideal balance of relaxation and opportunity."
Forest Hills,"$875,000",4,3.0,"3,500 sqft","Immerse yourself in the tranquility of Forest Hills with this exquisite 4-bedroom, 3-bathroom home. Nestled among mature trees, this property exudes charm and elegance. The home features a traditional floor plan, a formal dining room, and a cozy family room with a fireplace. The large, screened porch overlooks a private, landscaped yard. Perfect for those seeking a peaceful retreat in a beautiful, natural setting.","Forest Hills is a picturesque neighborhood known for its lush landscapes, historic homes, and friendly community vibe. It offers a unique blend of natural beauty and architectural charm. With access to top-notch schools, parks, and local markets, residents enjoy a high quality of life. The neighborhood maintains a serene environment while being conveniently located near city amenities."
Cedar Grove,"$500,000",3,2.0,"2,100 sqft","This cozy 3-bedroom, 2-bathroom home in Cedar Grove offers the perfect blend of comfort and convenience. The well-designed layout includes a welcoming living room, a spacious kitchen, and a dining area perfect for family gatherings. The backyard is a private haven, ideal for relaxation and outdoor activities. This home is an excellent choice for first-time homebuyers or those looking to downsize.","Cedar Grove is a warm and inviting neighborhood, characterized by its affordable housing, strong sense of community, and convenient location. It's well-suited for families and individuals seeking a quiet, suburban lifestyle with easy access to urban amenities. Cedar Grove boasts various parks, community centers, and schools, making it a desirable place for those seeking a balanced lifestyle."
