Neighborhood,Price,Bedrooms,Bathrooms,House Size,Description,Neighborhood Description
Cedar Ridge,"$625,000",4,3.0,"2,800 sqft","This stunning 4-bedroom, 3-bathroom home in Cedar Ridge offers comfort and luxury in a prime location. With a modern kitchen featuring stainless steel appliances, a large island, and quartz countertops, it's perfect for entertaining. The master suite provides a tranquil retreat with its spa-like bathroom and walk-in closet. Enjoy the professionally landscaped backyard with a covered patio for year-round use. Cedar Ridge offers a unique blend of elegance and practicality for a discerning homeowner.","Cedar Ridge is renowned for its peaceful surroundings and well-maintained homes. It's a family-friendly neighborhood with high-rated schools, numerous parks, and recreational facilities. The community boasts a vibrant shopping district with boutiques and restaurants. Its residents enjoy the perfect mix of suburban tranquility and convenient access to urban amenities."
Bluewater Bay,"$350,000",2,2.0,"1,500 sqft","Discover the charm of coastal living in Bluewater Bay. This captivating 2-bedroom, 2-bathroom home features an open floor layout with breathtaking views of the bay. The sunlit living area leads to a wide balcony, inviting you to relax and enjoy the serene water views. With a spacious master bedroom and a modern kitchen, this home combines comfort with elegance. Bluewater Bay is perfect for anyone looking for a peaceful retreat close to nature.","Bluewater Bay is a scenic waterfront community with a laid-back atmosphere. It offers a variety of water activities, including boating, fishing, and kayaking. The neighborhood is dotted with quaint cafes and seafood restaurants, providing a taste of the local cuisine. With its friendly community and beautiful landscapes, Bluewater Bay is an idyllic place to call home."
Aspen Meadows,"$975,000",5,4.0,"3,500 sqft","Experience luxury living in Aspen Meadows with this exquisite 5-bedroom, 4-bathroom residence. The home features a grand foyer, a gourmet kitchen with high-end appliances, and a spacious living area with a stone fireplace. The outdoor space includes a beautiful patio, perfect for entertaining, and a landscaped garden. The master suite offers a lavish bathroom and a large walk-in closet. Aspen Meadows is the epitome of sophistication and comfort.","Aspen Meadows is an exclusive community known for its luxurious homes and pristine landscapes. The neighborhood prides itself on its security, privacy, and a high standard of living. Residents enjoy access to private golf courses, tennis courts, and a country club. With its picturesque settings and deluxe amenities, Aspen Meadows is the ultimate destination for those seeking an affluent lifestyle."
Maple Grove,"$415,000",3,2.5,"2,100 sqft","Welcome to this charming 3-bedroom, 2.5-bathroom home in Maple Grove. The property includes a welcoming front porch, a cozy living room with a fireplace, and a spacious kitchen with modern appliances. The backyard is a quiet oasis with a deck and lush landscaping, perfect for outdoor gatherings. Maple Grove offers a harmonious blend of comfort and convenience in a friendly community.","Maple Grove is a vibrant neighborhood with a strong sense of community. It features a mix of residential and commercial areas, providing residents with easy access to shops, schools, and parks. The neighborhood hosts various community events throughout the year, fostering a sense of belonging among residents. Maple Grove is ideal for families looking for a nurturing and dynamic environment."
Sunnyvale Acres,"$490,000",3,2.5,"1,900 sqft","Nestled in the heart of Sunnyvale Acres, this 3-bedroom, 2.5-bathroom home offers a perfect blend of comfort and simplicity. The house features an efficient layout with a spacious living room, a dining area, and a kitchen with ample storage. The master bedroom includes an en-suite bathroom and a walk-in closet. The large, fenced backyard with a patio provides a safe and private space for relaxation. Sunnyvale Acres is a welcoming neighborhood that combines suburban tranquility with convenient access to city life.","Sunnyvale Acres is a peaceful and inviting community, known for its well-kept homes and friendly neighbors. It provides a suburban feel with plenty of green spaces and parks for outdoor activities. The neighborhood has easy access to shopping centers, restaurants, and schools, making it an ideal location for families. Sunnyvale Acres embodies a laid-back lifestyle while being within reach of metropolitan amenities."
